userId,message,reply,intent,timestamp
"68684462c3b4a95950130022","great.  got any advice on how to handle a date?","When it comes to handling a date, confidence is key. Here are some tips for a successful date: * **Be Yourself:** Authenticity is attractive. Be genuine and true to who you are. * **Plan Ahead:** Have a plan in mind to show you've put thought into the date. * **Listen:** Show interest in your date by actively listening and engaging in conversation. * **Dress Well:** Dress appropriately for the occasion to make a good impression. * **Be Respectful:** Treat your date with respect and make them feel comfortable. * **Have Fun:** Enjoy the moment and focus on creating a positive experience for both of you. Remember, dating is about getting to know each other, so relax and be yourself. How does that advice sound to you? Any specific date in mind that you'd like advice for?","dating_advice",2025-07-27T04:54:43.717Z
"68684462c3b4a95950130022","yeah.  But are you still Jules?","Absolutely! I'm still Jules, here to help with any questions or advice you need. If you have any specific topics in mind or need some recommendations,","general_conversation",2025-07-27T04:54:10.814Z
"68684462c3b4a95950130022","so I can see if we're tracking user behavior","Tracking user behavior is key for understanding how people interact with your platform. It helps in improving user experience and making informed decisions. If you're looking to optimize user engagement or enhance your tracking methods,","general_conversation",2025-07-27T04:53:55.005Z
"68684462c3b4a95950130022","I'm testing the logs","Testing the logs sounds important. It's great to make sure everything's running smoothly! If you need any tips or guidance on logging or testing processes, feel free to ask.","general_conversation",2025-07-27T04:53:45.514Z
"68684462c3b4a95950130022","can you show me some white sneakers?","Here are a few great options for white sneakers: 1. **Adidas Stan Smith:** A timeless classic known for its clean design and versatility. 2. **Nike Air Force 1:** Iconic and stylish, a streetwear staple that can elevate any casual look. 3. **Converse Chuck Taylor All Star:** A classic sneaker that's effortlessly cool and easy to style. 4. **Vans Old Skool:** A popular choice for a laid-back, skater-inspired vibe. These options offer different styles and vibes, so you can choose based on your personal preferences and how you plan to wear them.","style_advice",2025-07-27T04:49:46.882Z
"68684462c3b4a95950130022","can you show me some white neakers","Absolutely! White sneakers are a versatile and stylish choice. Give me a moment to find some great options for you.","greeting",2025-07-27T04:49:20.290Z
"68684462c3b4a95950130022","alright.  Things are moving forward in life.  I'm stoked","That's awesome to hear! It's great to feel that forward momentum in life. What's got you feeling stoked these days? Let's keep that positive energy flowing!","greeting",2025-07-27T04:48:57.132Z
"68684462c3b4a95950130022","hey jules","Hey there! What's on your mind? If you need any advice or just want to chat, feel free to share!","greeting",2025-07-27T04:48:47.952Z